document_name,file_path,clause_or_section,regulatory_topic,target_upgrade,target_stage,target_dc,target_batch,target_rule_type,expected_runtime_use,expected_writer_constraint,required_or_optional,available_status,notes
MDR_2017_745_Annex_XIV,/Users/winstonwei/CER-RAG/Source/EU MDCG/MDR_2017_745.pdf,Annex XIV Part A,Clinical evaluation general requirements,U1,S5,DC-4,E,structural_requirement,CER_structure_validator,Must address all Annex XIV elements,required,available,Maps to U1 E
MDCG_2020_5_Equivalence,/Users/winstonwei/CER-RAG/Source/EU MDCG/MDCG_2020_5_EN.pdf,Section 3-4,Equivalence criteria and demonstration,U3,S7,equivalence,F,equivalence_checklist,equivalence_runtime_gate,Must demonstrate 3-dim comparison or use non-equivalence path,required,available,Maps to U3 F
MDCG_2020_6_Sufficient_Clinical_Evidence,/Users/winstonwei/CER-RAG/Source/EU MDCG/MDCG_2020_6_EN.pdf,Section 5,Sufficient clinical evidence requirements,U1,S5,DC-4,E,evidence_sufficiency,clinical_fact_validator,Must link claims to evidence with appropriate strength,required,available,Maps to U1 E
MDCG_2020_10_1_Safety_Reporting,/Users/winstonwei/CER-RAG/Source/EU MDCG/MDCG_2020_10_1_EN.pdf,Section 2-3,Safety and incident reporting,U5,S10,BR_GSPR,G,safety_reporting,AE_validator,Must report all SAEs and device deficiencies,required,available,Maps to U5 G
ISO_14155_Clinical_Investigation,/Users/winstonwei/CER-RAG/Source/EU MDCG/ISO_14155_2020.pdf,Section 6-7,AE terminology and reporting,U1,S5,DC-6,E,AE_classification,endpoint_classifier,Must use ISO 14155 AE definitions,required,available,Maps to U1 E
ISO_14971_Risk_Management,/Users/winstonwei/CER-RAG/Source/EU MDCG/ISO_14971_2019.pdf,Section 7-8,Risk management process,U5,S10,BR_GSPR,G,risk_control,risk_mitigation_validator,Must link risks to control measures,required,available,Maps to U5 G
MDCG_2019_7_GSPR_Checklist,/Users/winstonwei/CER-RAG/Source/EU MDCG/MDCG_2019_7_EN.pdf,Clinical GSPR clauses,GSPR clinical evidence requirements,U5,S10,BR_GSPR,G,GSPR_crosswalk,GSPR_clause_validator,Must map clinical evidence to GSPR clauses,required,available,Maps to U5 G
CEAR_Assessment_Report_Template,/Users/winstonwei/CER-RAG/Source/EU MDCG/CEAR_Template.pdf,Full document,NB assessment checklist,U6,S12,writer_QA,H,assessment_criteria,post_write_QA,Must meet NB assessment criteria,optional,available,Maps to U6 H
